{
  "$schema": "https://json-schema.org/draft/2020-12/schema",
  "title": "Indicator Sets v2.0",
  "type": "object",
  "required": ["schema_version", "indicators"],
  "properties": {
    "schema_version": {
      "type": "string",
      "const": "2.0.0"
    },
    "metadata": {
      "type": "object",
      "additionalProperties": true
    },
    "indicators": {
      "type": "array",
      "minItems": 1,
      "items": {
        "type": "object",
        "required": ["name", "type", "params"],
        "properties": {
          "name": { "type": "string", "minLength": 1 },
          "type": { "type": "string", "minLength": 1 },
          "timeframe": { "type": "string" },
          "params": {
            "type": "array",
            "minItems": 1,
            "maxItems": 10,
            "items": {
              "type": "object",
              "required": ["name"],
              "properties": {
                "name": { "type": "string", "minLength": 1 },
                "value": { "type": ["number", "integer", "string", "boolean"] },
                "range": {
                  "type": "object",
                  "required": ["min", "max", "step"],
                  "properties": {
                    "min": { "type": "number" },
                    "max": { "type": "number" },
                    "step": { "type": "number", "exclusiveMinimum": 0 }
                  },
                  "additionalProperties": false
                }
              },
              "additionalProperties": false
            }
          }
        },
        "additionalProperties": false
      }
    },
    "optimization_results": {
      "type": "array",
      "items": { "type": "object" }
    },
    "backtest": {
      "type": "object",
      "properties": {
        "source": { "type": "string", "enum": ["live", "historical"] },
        "symbol": { "type": "string" },
        "timeframe": { "type": "string" },
        "bars_used": { "type": "integer", "minimum": 0 }
      },
      "additionalProperties": true
    }
  },
  "additionalProperties": false
}
